{
  "$schema": "./exercise_schema.json",
  "schemaVersion": "1.0.0",
  "entity": "EXERCISE",
  "entityVersion": 2,
  "generatedAt": 1767398400000,
  "totalCount": 60,
  "description": "GymBro 官方动作库种子数据 - 每个部位 10 个精选训练动作（共 60 个）",
  "payload": [
    {
      "id": "off_5023c57c",
      "name": "杠铃卧推",
      "description": "经典胸部复合动作，兼顾力量与肌肉增长。",
      "muscleGroup": "CHEST",
      "category": "UPPER_BODY",
      "equipment": [
        "BARBELL",
        "BENCH"
      ],
      "targetMuscles": [
        "CHEST",
        "SHOULDERS",
        "TRICEPS"
      ],
      "secondaryMuscles": [
        "CORE"
      ],
      "difficulty": "INTERMEDIATE",
      "defaultSets": 3,
      "defaultReps": 10,
      "restTimeSeconds": 120,
      "steps": [
        "肩胛下沉后缩，稳定上背",
        "握距略宽于肩，杠铃下放至胸中部",
        "发力推起至手臂伸直但不过度锁死"
      ],
      "tips": [
        "全程控制杠铃轨迹",
        "避免肘外展过大，保护肩关节"
      ],
      "source": "OFFICIAL",
      "isCustom": false,
      "isOfficial": true,
      "createdAt": 1718716800000,
      "updatedAt": 1767398400000
    },
    {
      "id": "off_a9a8603d",
      "name": "哑铃卧推",
      "description": "哑铃提供更大活动范围，强化胸肌拉伸与控制。",
      "muscleGroup": "CHEST",
      "category": "UPPER_BODY",
      "equipment": [
        "DUMBBELL",
        "BENCH"
      ],
      "targetMuscles": [
        "CHEST",
        "SHOULDERS",
        "TRICEPS"
      ],
      "secondaryMuscles": [
        "CORE"
      ],
      "difficulty": "INTERMEDIATE",
      "defaultSets": 3,
      "defaultReps": 10,
      "restTimeSeconds": 90,
      "steps": [
        "平躺凳上，哑铃置于胸侧",
        "下降至上臂与地面平行或略低",
        "向上推起并在顶端收缩胸肌"
      ],
      "tips": [
        "手腕保持中立，避免外翻",
        "下放更慢，顶端更稳"
      ],
      "source": "OFFICIAL",
      "isCustom": false,
      "isOfficial": true,
      "createdAt": 1718716800000,
      "updatedAt": 1767398400000
    },
    {
      "id": "off_2e0b6890",
      "name": "上斜杠铃卧推",
      "description": "强调上胸与前三角肌，改善胸型厚度。",
      "muscleGroup": "CHEST",
      "category": "UPPER_BODY",
      "equipment": [
        "BARBELL",
        "BENCH"
      ],
      "targetMuscles": [
        "CHEST",
        "SHOULDERS",
        "TRICEPS"
      ],
      "secondaryMuscles": [
        "CORE"
      ],
      "difficulty": "INTERMEDIATE",
      "defaultSets": 3,
      "defaultReps": 8,
      "restTimeSeconds": 120,
      "steps": [
        "调整卧推凳至 30°–45°",
        "杠铃下放至上胸区域",
        "推起至顶端保持稳定"
      ],
      "tips": [
        "角度过高会偏肩，优先 30°",
        "下放控制避免弹胸"
      ],
      "source": "OFFICIAL",
      "isCustom": false,
      "isOfficial": true,
      "createdAt": 1767398400000,
      "updatedAt": 1767398400000
    },
    {
      "id": "off_cff83088",
      "name": "上斜哑铃卧推",
      "description": "上斜角度 + 哑铃轨迹，提升上胸发力感。",
      "muscleGroup": "CHEST",
      "category": "UPPER_BODY",
      "equipment": [
        "DUMBBELL",
        "BENCH"
      ],
      "targetMuscles": [
        "CHEST",
        "SHOULDERS",
        "TRICEPS"
      ],
      "secondaryMuscles": [
        "CORE"
      ],
      "difficulty": "INTERMEDIATE",
      "defaultSets": 3,
      "defaultReps": 10,
      "restTimeSeconds": 90,
      "steps": [
        "凳子 30°–45°，哑铃起于肩上方",
        "下降到胸上方两侧",
        "推起并收紧胸肌"
      ],
      "tips": [
        "肩胛保持稳定",
        "肘部略内收，减少肩压"
      ],
      "source": "OFFICIAL",
      "isCustom": false,
      "isOfficial": true,
      "createdAt": 1767398400000,
      "updatedAt": 1767398400000
    },
    {
      "id": "off_71b67f27",
      "name": "下斜杠铃卧推",
      "description": "更偏下胸与整体推举力量，关节压力相对更低。",
      "muscleGroup": "CHEST",
      "category": "UPPER_BODY",
      "equipment": [
        "BARBELL",
        "BENCH"
      ],
      "targetMuscles": [
        "CHEST",
        "TRICEPS",
        "SHOULDERS"
      ],
      "secondaryMuscles": [
        "CORE"
      ],
      "difficulty": "INTERMEDIATE",
      "defaultSets": 3,
      "defaultReps": 8,
      "restTimeSeconds": 120,
      "steps": [
        "固定好下斜凳并系紧腿部",
        "杠铃下放至下胸",
        "推起回到起始位置"
      ],
      "tips": [
        "保持臀部贴凳",
        "不要用反弹借力"
      ],
      "source": "OFFICIAL",
      "isCustom": false,
      "isOfficial": true,
      "createdAt": 1767398400000,
      "updatedAt": 1767398400000
    },
    {
      "id": "off_a19df483",
      "name": "哑铃飞鸟",
      "description": "孤立胸肌拉伸与收缩，强化胸肌外侧感觉。",
      "muscleGroup": "CHEST",
      "category": "UPPER_BODY",
      "equipment": [
        "DUMBBELL",
        "BENCH"
      ],
      "targetMuscles": [
        "CHEST"
      ],
      "secondaryMuscles": [
        "SHOULDERS"
      ],
      "difficulty": "NOVICE",
      "defaultSets": 3,
      "defaultReps": 12,
      "restTimeSeconds": 75,
      "steps": [
        "平躺凳上，双臂微屈保持固定",
        "向两侧缓慢打开至胸部充分拉伸",
        "夹胸回到顶端"
      ],
      "tips": [
        "肘角固定，避免变成推举",
        "下放不过度，保护肩前束"
      ],
      "source": "OFFICIAL",
      "isCustom": false,
      "isOfficial": true,
      "createdAt": 1767398400000,
      "updatedAt": 1767398400000
    },
    {
      "id": "off_3a373146",
      "name": "绳索夹胸（站姿）",
      "description": "绳索持续张力，适合泵感与胸中缝收缩。",
      "muscleGroup": "CHEST",
      "category": "UPPER_BODY",
      "equipment": [
        "CABLE"
      ],
      "targetMuscles": [
        "CHEST"
      ],
      "secondaryMuscles": [
        "SHOULDERS"
      ],
      "difficulty": "NOVICE",
      "defaultSets": 3,
      "defaultReps": 12,
      "restTimeSeconds": 60,
      "steps": [
        "站于龙门架中间，双手握把",
        "双臂向前内收并在胸前交叉",
        "缓慢还原保持张力"
      ],
      "tips": [
        "躯干稳定不耸肩",
        "顶端停 1 秒收缩"
      ],
      "source": "OFFICIAL",
      "isCustom": false,
      "isOfficial": true,
      "createdAt": 1767398400000,
      "updatedAt": 1767398400000
    },
    {
      "id": "off_1430ea07",
      "name": "俯卧撑（标准）",
      "description": "徒手胸部基础动作，适合热身与容量补充。",
      "muscleGroup": "CHEST",
      "category": "UPPER_BODY",
      "equipment": [
        "NONE"
      ],
      "targetMuscles": [
        "CHEST",
        "TRICEPS",
        "SHOULDERS"
      ],
      "secondaryMuscles": [
        "CORE"
      ],
      "difficulty": "BEGINNER",
      "defaultSets": 3,
      "defaultReps": 12,
      "restTimeSeconds": 60,
      "steps": [
        "双手略宽于肩，身体一条直线",
        "下放至胸接近地面",
        "推起回到起始位置"
      ],
      "tips": [
        "保持核心收紧避免塌腰",
        "肘部与躯干约 45°"
      ],
      "source": "OFFICIAL",
      "isCustom": false,
      "isOfficial": true,
      "createdAt": 1767398400000,
      "updatedAt": 1767398400000
    },
    {
      "id": "off_283cb641",
      "name": "器械坐姿推胸",
      "description": "轨迹稳定，适合新手建立推举发力与容量。",
      "muscleGroup": "CHEST",
      "category": "UPPER_BODY",
      "equipment": [
        "MACHINE"
      ],
      "targetMuscles": [
        "CHEST",
        "TRICEPS"
      ],
      "secondaryMuscles": [
        "SHOULDERS"
      ],
      "difficulty": "BEGINNER",
      "defaultSets": 3,
      "defaultReps": 10,
      "restTimeSeconds": 90,
      "steps": [
        "调整座椅使握把与胸同高",
        "控制推起至接近伸直",
        "缓慢回到胸部拉伸位"
      ],
      "tips": [
        "肩胛贴靠靠背",
        "不要耸肩代偿"
      ],
      "source": "OFFICIAL",
      "isCustom": false,
      "isOfficial": true,
      "createdAt": 1767398400000,
      "updatedAt": 1767398400000
    },
    {
      "id": "off_bc9c09ea",
      "name": "夹胸机（蝴蝶机）",
      "description": "稳定夹胸轨迹，强化胸肌收缩峰值。",
      "muscleGroup": "CHEST",
      "category": "UPPER_BODY",
      "equipment": [
        "MACHINE"
      ],
      "targetMuscles": [
        "CHEST"
      ],
      "secondaryMuscles": [
        "SHOULDERS"
      ],
      "difficulty": "BEGINNER",
      "defaultSets": 3,
      "defaultReps": 12,
      "restTimeSeconds": 60,
      "steps": [
        "前臂贴垫或握把，胸挺起",
        "向内夹至胸前收缩",
        "缓慢外放回到拉伸位"
      ],
      "tips": [
        "动作范围以胸部拉伸为准",
        "避免用肩带动"
      ],
      "source": "OFFICIAL",
      "isCustom": false,
      "isOfficial": true,
      "createdAt": 1767398400000,
      "updatedAt": 1767398400000
    },
    {
      "id": "off_63bab238",
      "name": "引体向上",
      "description": "经典背部自重复合动作，强化背阔肌与上背控制。",
      "muscleGroup": "BACK",
      "category": "UPPER_BODY",
      "equipment": [
        "PULL_UP_BAR"
      ],
      "targetMuscles": [
        "BACK",
        "ARMS"
      ],
      "secondaryMuscles": [
        "CORE"
      ],
      "difficulty": "INTERMEDIATE",
      "defaultSets": 3,
      "defaultReps": 8,
      "restTimeSeconds": 120,
      "steps": [
        "握杠悬垂，肩胛下沉",
        "用背部发力拉起至下巴过杠",
        "控制下降回到悬垂"
      ],
      "tips": [
        "避免耸肩缩颈",
        "全程控制下降"
      ],
      "source": "OFFICIAL",
      "isCustom": false,
      "isOfficial": true,
      "createdAt": 1718716800000,
      "updatedAt": 1767398400000
    },
    {
      "id": "off_dee0cb74",
      "name": "杠铃划船",
      "description": "厚背核心动作，提升背阔肌与菱形肌厚度。",
      "muscleGroup": "BACK",
      "category": "UPPER_BODY",
      "equipment": [
        "BARBELL"
      ],
      "targetMuscles": [
        "BACK"
      ],
      "secondaryMuscles": [
        "CORE",
        "HAMSTRINGS"
      ],
      "difficulty": "INTERMEDIATE",
      "defaultSets": 4,
      "defaultReps": 8,
      "restTimeSeconds": 120,
      "steps": [
        "髋部后坐，背部中立俯身",
        "杠铃拉向下腹/肚脐",
        "控制下放保持背部张力"
      ],
      "tips": [
        "避免借力摆动",
        "拉到身体贴近再下放"
      ],
      "source": "OFFICIAL",
      "isCustom": false,
      "isOfficial": true,
      "createdAt": 1718716800000,
      "updatedAt": 1767398400000
    },
    {
      "id": "off_ccd3a791",
      "name": "高位下拉",
      "description": "替代引体向上，适合补足背阔肌训练容量。",
      "muscleGroup": "BACK",
      "category": "UPPER_BODY",
      "equipment": [
        "LAT_PULLDOWN"
      ],
      "targetMuscles": [
        "BACK",
        "ARMS"
      ],
      "secondaryMuscles": [
        "CORE"
      ],
      "difficulty": "BEGINNER",
      "defaultSets": 3,
      "defaultReps": 10,
      "restTimeSeconds": 90,
      "steps": [
        "坐稳固定大腿，胸挺",
        "下拉至锁骨附近",